Scraping Date,Section,Product,Discount
2026-02-15,Accessories,Blubby Multi Clutcher ( Pack of 1 ),25
2026-02-10,Accessories,Sonal Brown Plastic Storage Racks ( Pack of 1 ),49
2026-02-15,Accessories,AUTOGROOMZ Windshield Only Double Clamp Car Mobile Holder - Black,35
2026-02-13,Accessories,CRAYLUXE Accu Pressure Bead Back / Lumbar Support Single Black,36
2026-02-14,Accessories,GEEO Accu Pressure Bead Back / Lumbar Support Single Black,24
2026-02-14,Accessories,"Portronics Clamp M3 Adjustable Car Mobile Phone Holder Stand for Dashboard & Windshield, 360degree Rotational, Strong Suction Cup, Compatible with 4 to 6 inch Devices(Black)",49
2026-02-12,Accessories,"delhideals Indian Flag for Car Dashboard, Office Table, Study Table & Drawing Table",53
2026-02-11,Accessories,QitmirMKT NEW KEYCHAIN LIGHTER WITH HIGH POWER LIGHT Multicolor Multipurpose Car Cigarette Lighter ( Pack of 1 ),17
2026-02-12,Accessories,"5 In 1 Multi Pin Universal Portable Adapter And Car Mobile Charging Cable For (iPhone,Type C and Micro USB)",36
2026-02-13,Accessories,"GEEO Universal Car Steering Knob, Car Steering Wheel Knob, Steering Wheel Spinner Knob, 360° Rotation Booster (3R Original)",27
2026-02-14,Accessories,"Aksmit Pack of -1 Car Gear Knob Protector Gear Shifter Cover for Anti-Scratch Car Gear Knob Cover and Dust Proof Nonslip Gear Cover for Car Universal Fit Silicon Car Gear Knob Stylish- Black, Silicone Rubber",46
2026-02-11,Accessories,Vertical9 Car Mobile Charger 3_in_1 cable Multicolour,52
2026-02-12,Accessories,Car Ashtrays Multi Color,54
2026-02-11,Accessories,Aksmit Premium Metal Key Cover Compitable for Maruti Suzuki Ignis,22
2026-02-15,Accessories,RONISH Neck Cushions Set of 2 Black,52
2026-02-15,Accessories,Tender care Memory Foam Back / Lumbar Support Single Black,23
2026-02-10,Accessories,Ezybe Self Adhesive Kichen Shelf Light Blue Plastic Storage Racks (Pack of 2),34
2026-02-11,Accessories,Digital Car Dashboard Alarm Clock and Stopwatch With Flexible Stand,31
2026-02-14,Accessories,"TANTRA Car Armrest Cover Cushion with 2 Storage Bags - Soft, Comfortable, Non-Slip Protector for Vehicle Center Console - Waterproof, Durable, and Stylish",35
2026-02-10,Accessories,"TANTRA Car Armrest Cover Cushion with 2 Storage Bags - Soft, Comfortable, Non-Slip Protector for Vehicle Center Console - Waterproof, Durable, and Stylish",16
2026-02-12,Footwear,Cozy Wear Black Men's Daily Slipper,52
2026-02-14,Footwear,Xtoon Grey Men's Outdoor Shoes,53
2026-02-10,Footwear,AROTEK Grey Men's Daily Slipper,45
2026-02-15,Footwear,PENNEN Green Women's Flats,33
2026-02-14,Footwear,Dream Makers - Black Women's Sandal Heels,50
2026-02-14,Footwear,Cozy Wear Brown Men's Daily Slipper,35
2026-02-11,Footwear,YOU LIkE Brown Men's Derby Formal Shoes,15
2026-02-13,Footwear,FUSEOWL Maroon Women's Flip Flop,51
2026-02-10,Footwear,PERY PAO Blue Men's Slide Flip Flop,45
2026-02-10,Footwear,YNP Design Collections Brown Women's Ethnic Ballerinas,36
2026-02-10,Footwear,ZYPSO Zypso Men’s Grey Synthetic Grey Men's Lifestyle Shoes,15
2026-02-10,Footwear,Cozy Wear Olive Men's Daily Slipper,47
2026-02-14,Footwear,hanuco Height Increasing Insoles,17
2026-02-14,Footwear,Asian Black School Shoes for Boys,25
2026-02-11,Footwear,BEE U NIK Black Men's Thong Flip Flop,33
2026-02-14,Footwear,SHUAN Brown Men's Slip on,36
2026-02-13,Footwear,Citipiti ind. Green Women's Flats,41
2026-02-15,Footwear,Squash Black Men's Thong Flip Flop,56
2026-02-12,Footwear,Z Brown Men's Slide Flip Flop,55
2026-02-13,Footwear,Radhe Creation Cream Polish Suitable for Black Color,34
2026-02-11,Kids Fashion,Cool and NIce kids Multi color Bermuda pack of 5,16
2026-02-14,Kids Fashion,"A.W.A KIDS FASHION Cotton Frock For Girls ( Pack of 1 , Blue )",32
2026-02-12,Kids Fashion,"A.W.A KIDS FASHION Cotton Blend Frock For Girls ( Pack of 1 , Pink )",24
2026-02-10,Kids Fashion,"A.W.A KIDS FASHION Cotton Blend Frock For Girls ( Pack of 1 , Light Blue )",49
2026-02-11,Kids Fashion,"Arshia Fashions Cotton Blend Shirt Dress For Girls ( Pack of 1 , Blue )",33
2026-02-12,Kids Fashion,"Arshia Fashions Girls Cotton Blend Kurti with Sharara ( Pack of 1 , Pink )",38
2026-02-14,Kids Fashion,"Villata fashion Net Frock For Girls ( Pack of 1 , White )",24
2026-02-14,Kids Fashion,"Nios Fashion Girls Cotton Polyester Jeans ( Pack of 2 , Multicolor 4 )",44
2026-02-14,Kids Fashion,"PMD Fashion Net Lehenga Choli Set For Girls ( Pack of 1 , Charcoal )",27
2026-02-11,Kids Fashion,s muktar garments - Green Cotton Blend Boys Professional Costume ( Pack of 1 ),26
2026-02-11,Kids Fashion,NI FASHION Pack of 1 Boys Cotton Blend T-Shirt ( Black ),48
2026-02-13,Kids Fashion,"Arshia Fashions Polyester Shirt Dress For Girls ( Pack of 1 , Multicolor )",55
2026-02-12,Kids Fashion,"Arshia Fashions Net Lehenga Choli Sets For Girls ( , Blue )",15
2026-02-13,Kids Fashion,NAYPAL FASHION STYLE Pack of 1 Boys & Girls Cotton Blend T-Shirt ( Pink ),38
2026-02-14,Kids Fashion,"Villata fashion Net Frock For Girls ( Pack of 1 , Red )",47
2026-02-12,Kids Fashion,"Arshia Fashions Polyester Blend Frock For Girls ( Pack of 1 , Red )",58
2026-02-10,Kids Fashion,KASEERA CUTE STYLISH AND TRENDING KIDS GYM VEST PACK OF 5,50
2026-02-14,Kids Fashion,"A.W.A KIDS FASHION Cotton Blend Frock For Girls ( Pack of 1 , Red )",59
2026-02-12,Kids Fashion,"Villata fashion Net Frock For Girls ( Pack of 1 , Red )",56
2026-02-15,Kids Fashion,"Arshia Fashions Polyester Fit And Flare Dress For Girls ( Pack of 1 , Purple )",46
2026-02-12,Men Clothing,TAZO Nylon Men's Windcheater Jacket - Blue ( Pack of 1 ),17
2026-02-12,Men Clothing,yellow tree Polyester Men's Casual Jacket - White ( Pack of 1 ),52
2026-02-14,Men Clothing,Reya Cotton Blend Men's Casual Jacket - Black ( Pack of 1 ),42
2026-02-15,Men Clothing,Mashaykh Polyester Men's Windcheater Jacket - White ( Pack of 1 ),53
2026-02-12,Men Clothing,eddicted Polyester Men's Puffer Jacket - Navy Blue ( Pack of 1 ),36
2026-02-15,Men Clothing,Montrez Cotton Blend Men's Casual Jacket - White ( Pack of 1 ),60
2026-02-10,Men Clothing,yellow tree Polyester Men's Casual Jacket - Black ( Pack of 1 ),47
2026-02-13,Men Clothing,Rigo Polyester Men's Puffer Jacket - Grey ( Pack of 1 ),26
2026-02-14,Men Clothing,IF-INDIAN FORT Polyester Men's Quilted & Bomber Jacket - Navy ( Pack of 1 ),40
2026-02-15,Men Clothing,TrendsTalk Nylon Men's Windcheater Jacket - Blue ( Pack of 1 ),41
2026-02-13,Men Clothing,Christy World Polyester Men's Casual Jacket - Black ( Pack of 1 ),50
2026-02-10,Men Clothing,Mashaykh Polyester Men's Windcheater Jacket - Black ( Pack of 1 ),17
2026-02-13,Men Clothing,Forbro Nylon Men's Windcheater Jacket - Black ( Pack of 1 ),21
2026-02-14,Men Clothing,Montrez Cotton Blend Men's Casual Jacket - Olive ( Pack of 1 ),23
2026-02-14,Men Clothing,AZF Nylon Men's Casual Jacket - Wine ( Pack of 1 ),42
2026-02-15,Men Clothing,TrendsTalk Nylon Men's Windcheater Jacket - Gold ( Pack of 1 ),17
2026-02-10,Men Clothing,eddicted Polyester Men's Puffer Jacket - Blue ( Pack of 1 ),46
2026-02-11,Men Clothing,FTX Denim Men's Denim Jacket - Light Blue ( Pack of 1 ),38
2026-02-15,Men Clothing,Forbro Nylon Men's Windcheater Jacket - Maroon ( Pack of 1 ),20
2026-02-12,Men Clothing,Christy World Polyester Men's Casual Jacket - Grey ( Pack of 1 ),20
2026-02-12,Women Clothing,Sheetal associates Women Polyester Printed Fit & Flare Dress ( Blue ),53
2026-02-12,Women Clothing,wanquila Women Lycra Solid Bodycon Dress ( Beige ),20
2026-02-10,Women Clothing,"KNOWZY Rayon Women Dupatta ( Magenta , Pack of 1 )",42
2026-02-10,Women Clothing,Sheetal associates Women Crepe Printed A-line Dress ( Orange ),25
2026-02-10,Women Clothing,TUHIRAJ Women Crepe Printed Gown ( Brown ),60
2026-02-15,Women Clothing,Sheetal associates Women Polyester Printed Fit & Flare Dress ( Brown ),27
2026-02-11,Women Clothing,"BLYNK Lycra Petticoat ( Pink , )",30
2026-02-12,Women Clothing,Fabverse Women Lycra Solid Bodycon Dress ( Black ),57
2026-02-15,Women Clothing,Sheetal associates Women Crepe Printed Shirt Dress ( Green ),56
2026-02-12,Women Clothing,Honky Tonky Women Polyester Self Design A-line Dress ( Pink ),24
2026-02-13,Women Clothing,Sheetal associates Women Crepe Printed Shirt Dress ( White ),20
2026-02-13,Women Clothing,JASH CREATION Women Cotton Blend Printed Fit & Flare Dress ( Pink ),28
2026-02-12,Women Clothing,Sheetal associates Women Crepe Printed A-line Dress ( White ),32
2026-02-13,Women Clothing,Fasanger Cotton Lycra Women's Shrugs - White ( ),57
2026-02-15,Women Clothing,Madhusudan Women Rayon Printed Ethnic Dress ( Pink ),39
2026-02-15,Women Clothing,THE LADIES FASHION Women Viscose Rayon Maxi ( White ),59
2026-02-14,Women Clothing,Sheetal associates Women Crepe Printed Fit & Flare Dress ( White ),41
2026-02-12,Women Clothing,NIVESTANA Women Viscose Rayon Gown ( Purple ),42
2026-02-12,Women Clothing,PIYURZ Pack of 6 Poly Cotton Solid Women's Briefs ( Multi Color ),21
2026-02-12,Women Clothing,MAYRAAFASHION Net Self Design Regular Saree With Unstitched Blouse Piece ( Pink ),25
